timestamp,image_response,url
2024_02_20_18_54,"La imagen muestra a una persona de pie en una pose relajada con una apariencia estilizada que incorpora elementos clásicos con un toque moderno y una posible influencia de la moda de menswear adaptada al prêt-à-porter femenino.

La prenda superior es una chaqueta bomber de longitud clásica y de corte holgado. Tiene un color verde oliva cálido con una textura lisa y mate. El cuello, puños y la cintura de la prenda parecen estar rematados con ribetes de punto elástico que presentan un contraste de color marrón oscuro o negro. La chaqueta se abrocha con botones y, aunque no se ven detalles específicos como logos, la simplicidad y la calidad del diseño sugieren que podría tratarse de una pieza de diseñador o de una marca contemporánea de moda.

En cuanto a la parte inferior, lleva pantalones de talle alto que hacen alusión a la moda de la década de 1980 o principios de los 90 por su corte voluminoso. Los pantalones presentan un patrón de rombos acolchados, creando un efecto de textura que agrega profundidad y un interés visual único a la prenda. El color es un azul oscuro que podría interpretarse como una reinterpretación vanguardista del denim clásico. El acolchado podría remitir a estilos utilitarios o prendas de abrigo, pero su uso en pantalones arroja un espíritu experimental y contemporáneo.

La modelo lleva un cinturón de cuero negro, básico y funcional, que ayuda a acentuar la cintura y a brindar equilibrio a la silueta ampliada de los pantalones. La camiseta interior parece ser de un tejido de algodón simple, en un tono oscuro que coordina con el conjunto general.

Para el calzado, opta por botas negras de piel con un acabado liso y brillante, que ascienden ligeramente por encima del tobillo. Este tipo de calzado es un clásico que permite versatilidad, desde estilos casual hasta formales.

Complementando el atuendo, la pose y la expresión de la persona transmiten una actitud segura y despreocupada, lo que armoniza con la estética minimalista y andrógina del conjunto. El peinado es una melena corta y lisa con un toque natural.

El estilo general podría ser parte de una colección de una marca contemporánea que valora la reinterpretación de elementos utilitarios en la moda urbana, con una paleta de colores tierra y azules profundos que evoca una esencia otoñal. Aunque no hay indicaciones visibles de la marca o diseño específicos, el enfoque en textiles de calidad y cortes amplios sugiere una conciencia por la comodidad sin sacrificar la sofisticación ni el estilo.",https://assets.vogue.com/photos/65c249a236b4e0759ccfb5f9/master/w_2560%2Cc_limit/00002-rag-and-bone-fall-2024-ready-to-wear-credit-brand.jpeg
2024_02_20_18_54,"La imagen muestra a una persona posando frente a una ventana con luz natural, en un ambiente que evoca un estilo urbano y casual chic. El sujeto está vestido con varias capas de ropa que combinan texturas y colores para crear un look contemporáneo con influencias clásicas.

La prenda exterior es un cárdigan de punto grueso color crema, con un patrón de trenzas que se asocia tradicionalmente con el clásico suéter de punto irlandés. El cárdigan presenta una abertura frontal sin cierres, lo que sugiere un estilo más relajado y casual. Debajo del cárdigan, se observa una chaqueta bomber en color verde oliva, que proporciona un contraste utilitario al conjunto. La chaqueta bomber, una pieza que se popularizó después de la Segunda Guerra Mundial, tiene raíces militares y ha sido reinterpretada de manera constante en la moda contemporánea.

La persona lleva una camisa con un patrón vertical de rayas en tonos verde oscuro, blanco y posiblemente negro o azul marino, lo que añade sofisticación y una cierta rigidez visual que balancea la textura despreocupada del punto. La camisa tiene un cuello clásico y parece estar hecha de un tejido liso, probablemente algodón o una mezcla que imita su apariencia.

El estilo general podría estar influenciado por tendencias retro o vintage, pero con un giro moderno y sustentable, dado que las texturas y la superposición de prendas se alinean con prácticas contemporáneas en la moda, como el layering. No se aprecian claramente logos o etiquetas que indiquen una marca específica, lo cual pone el énfasis en el estilo y la combinación de prendas más que en la identidad de diseño.

El look se completa con pantalones negros ajustados, que proporcionan una silueta estilizada y contemporánea, y un cinturón negro con una hebilla metálica simple. La elección del pantalón ajustado sugiere una influencia de la moda skinny de mediados de los años 2000 hasta la actualidad.

La paleta de colores —crema, verde oliva, negro y el patrón de rayas de la camisa— favorece la temporada otoñal. La luz natural y la escenografía crean una atmósfera cálida que complementa el look. La persona exhibe una postura confiada, y su cabello está peinado hacia atrás de manera natural, lo que aporta un aire juvenil y refinado al conjunto.

La moda retratada en la foto podría estar alineada con marcas que valoran los elementos clásicos, pero con un giro hacia la relevancia contemporánea, potencialmente apuntando a un consumidor joven y consciente de las tendencias actuales.",https://assets.vogue.com/photos/65c249a00140a4bcc056b573/master/w_2560%2Cc_limit/00003-rag-and-bone-fall-2024-ready-to-wear-credit-brand.jpeg
2024_02_20_18_55,"La imagen muestra una modelo femenina posando en un estudio con fondo blanco, llevando un conjunto de dos piezas que sugiere una influencia moderna con toques clásicos en su diseño. El atuendo consiste en una chaqueta y una falda a juego, ambos confeccionados en una tela con textura matelassé, conocida por su apariencia acolchada y patrones geométricos en relieve que le dan una sensación táctil tridimensional.

La chaqueta tiene un corte ajustado alrededor de la cintura, con una longitud que llega justo por encima de la cadera, lo que crea una silueta elegante que acentúa la figura. El cierre frontal presenta una fila única de botones grandes, posiblemente de perla o de un material similar, que se alinean verticalmente desde el cuello hasta el borde inferior, otorgando un aspecto pulido y refinado. El cuello alto le da un toque distinguido al conjunto, lo que podría ser una referencia a estilos victorianos o eduardianos, pero con una interpretación contemporánea.

La falda es de corte mini, con una longitud que sube por encima del muslo, añadiendo un toque juvenil y moderno al conjunto. La consistencia de la tela y el patrón acolchado coincide con el de la chaqueta, creando un look uniforme y coordinado. Las líneas limpias y la falta de decoración adicional en la falda centran la atención en la textura de la tela.

Los zapatos son clásicos mocasines de cuero negro con un brillo patente y detalles de borlas, lo que añade una dimensión de sofisticación. La elección del calzado complementa a la perfección el conjunto, manteniendo el enfoque en la ropa a la vez que aporta un balance entre lo clásico y lo contemporáneo.

La modelo sostiene una manzana roja en su mano derecha extendida, lo que podría ser un toque artístico por parte del fotógrafo o un elemento simbólico.

No hay referencias explícitas a un diseñador concreto en la descripción, pero el look y la calidad del atuendo podrían sugerir una pieza de una colección de una casa de moda de lujo que valora los acabados de alta calidad y un estilo refinado.

El estilo general de la imagen y el atuendo podrían insinuar una tendencia hacia la elegancia atemporal combinada con líneas y siluetas modernas. Es una fusión de tradición textil con cortes contemporáneos, algo que es muy común en las colecciones de diseñadores que buscan reinterpretar la moda clásica para el público actual.",https://assets.vogue.com/photos/65ba546a5f8958b63b8d488d/master/w_2560%2Cc_limit/00002-sara-battaglia-fall-2024-ready-to-wear-credit-brand.jpg
2024_02_20_18_55,"La imagen muestra a una mujer de pie que lleva un abrigo largo con un diseño notable. El abrigo presenta una serie de rayas verticales en colores amarillo y negro, que son colores contrastantes y clásicos en la moda, a menudo asociados con un estilo audaz y atrevido. La disposición vertical de las rayas favorece visualmente al alargar y estilizar la figura de la persona que lo lleva.

El abrigo cuenta con una silueta recta y estructurada, una característica que se mantiene con la ayuda de costuras prominentes. La longitud del abrigo es midi, cayendo aproximadamente hasta la mitad de la pantorrilla, lo cual es elegante y proporciona una cobertura considerable. Dispone de un cierre frontal que parece ser de cremallera, notable por los tiradores de metal que contrastan con el diseño de rayas. Además, la presencia de bolsillos con solapas y cremalleras añade un detalle funcional y un atractivo visual adicional.

El cuello del abrigo es elevado, lo que puede ofrecer protección contra elementos como el viento y añade un detalle de diseño que refuerza el aspecto general. La manga es larga y parece tener un corte simple, sin puños ajustados ni adornos adicionales.

La modelo ha combinado su abrigo con pantalones negros que no son completamente visibles debido al largo del abrigo. Los zapatos que asoman por debajo son negros, de aspecto suave y brillante, lo que podría sugerir que son de cuero. Parecen mocasines o zapatos de corte similar, lo que sugiere un enfoque en la comodidad y el estilo clásico.

El peinado de la modelo es de trenzas largas que caen sobre la espalda y los hombros, y su rostro muestra una expresión amistosa y confiada.

Este conjunto podría sugerir una combinación de elementos de tendencias contemporáneas con influencias de la moda clásica. Asimismo, el patrón de rayas y los elementos de diseño destacan por su atemporalidad, y podría remitir tanto a elementos de moda vintage como a interpretaciones modernas del uso de estampados gráficos. Sin embargo, la identificación de la época o el diseñador específico requeriría información contextual adicional o el reconocimiento de una firma distintiva, lo cual no se puede discernir únicamente con esta descripción.",https://assets.vogue.com/photos/65ba546a4f005afdef36c860/master/w_2560%2Cc_limit/00003-sara-battaglia-fall-2024-ready-to-wear-credit-brand.jpg
2024_02_20_18_56,"La imagen muestra a una persona modelando una prenda de vestir que parece estar inspirada en la moda de deportes de invierno, particularmente el esquí. La persona está usando un conjunto monocromático de color blanco crudo u off-white que sugiere una estética moderna y funcional.

La chaqueta tiene una silueta amplia, posiblemente con relleno aislante que sugiere protección en climas fríos. Se nota un cierre frontal, bolsillos con solapas, y posiblemente cintas o tiras de ajuste que pueden servir tanto fines estéticos como funcionales, como el ajuste de la prenda o la sujeción de accesorios de esquí. Aparecen detalles en un tono contrastante, posiblemente un gris claro o plata, que destacan en la marca escrita en la parte frontal del pecho y otros detalles como cremalleras o textos en los brazos.

El pantalón mantiene esta misma paleta de colores y está diseñado para complementar la chaqueta, también parece estar hecho de un material técnico, resistente al agua y aislante. La silueta de los pantalones es relativamente ceñida pero se expande ligeramente hacia la parte baja para acomodar botas, y tiene refuerzos o paneles que podrían sugerir áreas de mayor desgaste o exposición.

La persona lleva también una gorra de esquí y unas gafas, ambos accesorios comunes en indumentaria de deportes de invierno, reforzando la temática del atuendo. Complementan el conjunto unas botas robustas de tono oscuro, posiblemente diseñadas para la nieve.

Además, porta un bolso deportivo grande de mano en colores blanco y negro que combina con el atuendo.

Este atuendo podría ser parte de una colección de una marca de moda que fusiona la alta tecnología de prendas deportivas con el diseño de moda para crear atuendos funcionales aptos para ambientes invernales y deportivos, pero con un sentido muy marcado de estilo y diseño contemporáneo. No hay suficientes elementos distintivos en la imagen para atribuir la obra a un diseñador o marca específica, pero el diseño refleja tendencias actuales en la moda invernal y de deportes de nieve.",https://assets.vogue.com/photos/65bfa61ed07e7e093468e74b/master/w_2560%2Cc_limit/00002-moncler-grenoble-fall-2024-ready-to-wear-credit-brand.jpg
2024_02_20_18_56,"La imagen presenta un modelo masculino desfilando por una pasarela que simula un ambiente invernal, dotada de nieve artificial y neblina, conjurando probablemente una colección otoño-invierno. El conjunto principal es monocromático, dominado por el blanco, lo cual lo hace apropiado para un ambiente nevado y puede ser indicativo de una tendencia actual de usar colores sólidos y neutros en prendas de outerwear.

El modelo lleva una chaqueta de esquí de gran tamaño con detalles funcionales, como cremalleras y bolsillos amplios que enfatizan la utilidad. La firma del diseñador o marca es visible sobre el brazo izquierdo en una banda que podría ser de velcro, un elemento estilístico popular en la moda de inspiración técnica y deportiva. La chaqueta tiene capucha, que se presenta baja y envuelve un grueso cuello de bufanda o snood de punto en color gris, contrastando sutilmente con el blanco y agregando textura al atuendo.

Los pantalones a juego son también blancos, con un corte que recuerda los pantalones de esquí, reforzados quizás en las rodillas, y se observa un ajuste en la parte inferior para adaptarse al calzado, asegurando la nieve se mantenga fuera. Esto, junto con el casco de esquí que el modelo carga bajo el brazo, claramente asocia la colección con deportes de invierno y ropa técnica.

El calzado parece funcional y robusto, posiblemente botas de montaña con detalle de encaje que recuerda a un patrón geométrico, lo cual introduce un sutil contraste en el dominio del blanco.

La apariencia general del atuendo sugiere que la colección está diseñada para ser tanto funcional como estilística, una característica común en las líneas de ropa de ""alta montaña"" que buscan fusionar moda con funcionalidad. Los diseñadores y marcas contemporáneos frecuentemente buscan inspiración en la indumentaria deportiva para crear piezas que sean adecuadas para el uso diario, así como para condiciones climáticas extremas. Esto puede ser un reflejo del creciente interés en la moda sustentable y duradera. Las texturas son abrigadas y adecuadas para el frío, y la paleta de colores es apropiada para la temporada y la ocasión.",https://assets.vogue.com/photos/65bfa61e1cbd65155fa7a82f/master/w_2560%2Cc_limit/00003-moncler-grenoble-fall-2024-ready-to-wear-credit-brand.jpg
2024_02_20_18_57,"La imagen muestra a una modelo en una pasarela posiblemente durante una exhibición de moda. La vestimenta que lleva es vanguardista y llama la atención por su diseño único que desafía las siluetas convencionales.

La prenda principal es un top sin hombros (off-shoulder), de color blanco con una textura plisada que añade volumen y una sensación de movimiento. Este detalle plisado es reminiscente de técnicas de costura utilizadas en alta costura, generando una complejidad visual en la prenda. El top es dramático y ocupa la mayoría de la atención en el outfit, gracias a su estilo abultado que crea una forma bulbosa envolviendo el torso de la modelo. Esta articulación particular puede sugerir exploración en la forma y estructura, lo cual es común en la moda conceptual.

En la parte inferior, la modelo lleva lo que parecen ser unos pantalones cortos o shorts de tiro alto en un tono que combina con el top, lo cual mantiene la atención en la parte superior del conjunto. Los shorts son de una tela ligera y parecen tener una textura suave, lo que contribuye a una apariencia de confort y sencillez para equilibrar la prenda superior más elaborada.

En sus pies, lleva zapatos planos en color negro que contrastan sutilmente con el resto del atuendo, y cuyas puntas hacia arriba añaden un toque juguetón y distintivo al conjunto. El lazo en los zapatos proporciona un acabado femenino y sofisticado.

El cabello de la modelo está corto y peinado hacia adelante con un estilo fresco y juvenil, lo que complementa la naturaleza moderna del outfit. El maquillaje parece ser mínimo, manteniendo la atención en la ropa.

El estilo podríam relacionarse con las tendencias actuales que favorecen siluetas desestructuradas y enfoques conceptuales en la moda. No hay referencias directas a una época pasada, sino más bien una mirada hacia la innovación en el diseño de la moda contemporánea.

En general, el atuendo podría ser una expresión de la moda experimental donde la forma, la textura y el volumen se exploran de manera que desafían las expectativas tradicionales del vestir diario o formal. Este conjunto bien podría ser obra de un diseñador que se especializa en la alta moda y que está interesado en la creación de piezas que provoquen diálogos acerca de la forma y función en la moda.",https://assets.vogue.com/photos/65c234b57d5c040e2986a2a9/master/w_2560%2Cc_limit/00002-olivia-ballard-fall-2024-ready-to-wear-berlin-credit-james-cochrane-bfw.jpg
2024_02_20_18_57,"La imagen muestra a una modelo desfilando en lo que parece ser una pasarela de moda situada en un espacio con paredes de cristal, permitiendo ver el exterior urbano al fondo. La modelo lleva una indumentaria que destaca por su estética futurista y vanguardista.

La prenda que más resalta es una chaqueta abultada de color blanco. Esta chaqueta tiene un gran volumen con lo que parece ser un acolchado generoso, lo que le da una textura que podría describirse como ""inflada"" o ""acolchonada"" y sugiere que podría estar hecha con materiales sintéticos diseñados para el aislamiento. Su cuello alto y la capucha que también parece acolchada aportan un toque de protección adicional, que puede sugerir una inspiración en la ropa de exteriores alta tecnología o incluso de indumentaria espacial.

La modelo también lleva unos leggings o mallas blancas de cintura alta que ajustan ceñidamente su cuerpo, lo que crea un fuerte contraste con la amplia chaqueta, enfatizando la silueta y las formas naturales del cuerpo de la modelo. El tejido de las mallas parece liso y elástico, que contrasta con la textura más rugosa de la chaqueta.

Los zapatos son unos tacones negros de diseño inusual, con lo que parece ser una plataforma dividida o un tacón escultural, dando un toque moderno y poco convencional al conjunto. Se suman al interés del diseño al romper con la estética minimalista y monocromática del traje.

Por último, la modelo usa guantes que llevan cada uno un color distinto: uno amarillo y otro azul claro, que añaden una nota de contraste llamativa en comparación con el resto del atuendo monocromático. Estos elementos proporcionan un toque inesperado y pueden interpretarse como una referencia lúdica o una expresión de individualismo dentro de la moda.

El conjunto de la modelo podría estar inspirado en tendencias de moda futuristas o en la moda conceptual, y debido a su estética avanzada y experimental, podría ser obra de un diseñador de moda contemporáneo con una visión vanguardista. Los elementos como el tacones esculturales y el juego asimétrico de colores en los guantes pueden indicar una influencia de la moda conceptual o de arte de desgaste, donde la ropa trasciende su función tradicional para hacer declaraciones artísticas o conceptuales.",https://assets.vogue.com/photos/65c234b644bdf11f2cefab0d/master/w_2560%2Cc_limit/00003-olivia-ballard-fall-2024-ready-to-wear-berlin-credit-james-cochrane-bfw.jpg
2024_02_20_18_58,"Estoy observando una imagen que presenta a un modelo masculino vistiendo una combinación de prendas que fusionan elementos clásicos con toques modernos y una sutil mezcla de texturas. El modelo lleva un traje de tres piezas que consiste en:

- **Chaleco**: La prenda más llamativa es un chaleco grueso sin mangas de color beige claro, posiblemente de lana o una mezcla sintética que imita una textura que podría ser sherpa o borrego, lo que aporta una sensación táctil acogedora. La presencia de este chaleco sobre la indumentaria formal da un toque desenfadado y contemporáneo e introduce una superposición interesante de texturas.

- **Traje de rayas**: Debajo del chaleco, el modelo viste un traje de raya diplomática en un tono oscuro, que parece ser de color negro o azul marino muy oscuro. La raya diplomática es un patrón clásico asociado con la sastrería formal para hombres.

- **Camisa y corbata**: La camisa de un azul celeste claro es un contraste claro y clásico bajo el traje oscuro. Está complementada con una corbata delgada de color sólido que parece ser gris oscuro, lo que sugiere un balance entre la formalidad y la moda juvenil.

En cuanto a la silueta y el corte del traje:
- La chaqueta tiene solapas en punta y parece ajustada, pero no se ve enteramente debido al chaleco.
- Los pantalones parecen tener un corte recto clásico y se observa una caída limpia sobre los zapatos, lo que sugiere un buen trabajo de sastrería.

- **Calzado**: El modelo lleva zapatos derby negros pulidos. Este tipo de zapato es una elección tradicional que complementa la formalidad implícita del traje. La elección de zapatos pulidos refuerza la estética general que oscila entre lo tradicional y lo moderno.

En conjunto, el atuendo juega con las expectativas de la moda masculina formal incorporando la prenda superior de textura suave y cálida sobre una silueta clásica y ajustada. La mezcla de prendas y contrastes de texturas señalan una posible tendencia de invierno, en la que se busca combinar confort con la formalidad, manteniendo una sutil elegancia. Es difícil determinar un diseñador o marca específica sin más información, pero la elección de las prendas sugiere una colección que puede estar dirigida a un público joven profesional que valora la moda con un toque de personalización y confort.

Las referencias podrían ser de una colección de otoño/invierno de una línea de moda que explora la reinterpretación de la indumentaria formal clásica para el hombre moderno, en la que se mezclan texturas y patrones tradicionales con elementos de diseño contemporáneos.",https://assets.vogue.com/photos/65c13c4dd5fb09e4ef8e14e2/master/w_2560%2Cc_limit/00002-sunflower-copenhagen-fall-2024-menswear-credit-brand.jpg
2024_02_20_18_59,"Estoy observando una imagen de un hombre de pie, vestido con un atuendo que mezcla piezas clásicas con un toque casual urbano. La pieza central de su atuendo es una chaqueta de cuero negra, una prenda icónica con una larga historia en la moda, asociada a menudo con la subcultura del motociclismo y la rebelión juvenil, pero que también se ha adaptado a un estilo más sofisticado y maduro.

Debajo de la chaqueta, lleva una camisa de cuadros con cierre de botones en rojos y grises, cuyo patrón le da un aire casual y es un elemento recurrente en el vestuario masculino, a menudo asociado con la moda de estilo americano de la clase trabajadora o el look preppy, dependiendo del corte y el contexto.

El hombre usa unos jeans de denim azul, que parecen ser de corte ancho, lo que podría considerarse una referencia al estilo de los jeans más holgados de los años 90. La presencia de costuras visibles y el lavado claro del denim agregan carácter a la pieza y mantienen la vibra casual y relajada del conjunto. Los jeans de denim son universales en la moda, con raíces en la ropa de trabajo, y han evolucionado para incorporar diversas formas y siluetas a lo largo de las décadas.

En sus pies, lleva lo que parecen ser zapatos robustos, tal vez botas o zapatos de trabajo de cuero negro. Este tipo de calzado complementa el aspecto funcional y urbano del outfit, proporcionando una base sólida y utilitaria al look.

Si bien las prendas no muestran logos visibles o detalles distintivos que puedan atribuirse a una marca específica de diseño de alta gama, el estilo general es contemporáneo y transmite una apreciación por las prendas clásicas adaptadas a un contexto moderno. La combinación de prendas sugiere una preferencia por la comodidad y la funcionalidad sin comprometer el estilo.

El hombre lleva su cabello en rastas, lo que añade una dimensión personal y cultural a su estilo general, sugiriendo una mezcla de influencias y una afirmación de identidad individual.

En resumen, el conjunto es un buen ejemplo de la moda contemporánea que fusiona elementos clásicos y urbanos, resultando en un look relajado pero estilizado, que parecería estar en casa tanto en un ambiente urbano casual como en un entorno más estructurado y profesional.",https://assets.vogue.com/photos/65c13c4e0039d689f44246fb/master/w_2560%2Cc_limit/00003-sunflower-copenhagen-fall-2024-menswear-credit-brand.jpg
