timestamp,image_response,url
2024_02_20_18_59,"Estás observando una imagen que presenta a un modelo masculino de pie con una postura firme y directa. Viste un conjunto de dos piezas que parece ser de cuero o de un material similar con un acabado brillante que sugiere un enfoque moderno y ligeramente futurista en el diseño de la prenda.

La parte superior es una camisa de manga larga, con cuello clásico y una hilera de botones metálicos visibles que le dan un toque industrial. La camisa tiene un corte recto y luce holgada alrededor del torso, lo que crea una silueta estructurada pero no ajustada. Las mangas parecen tener un ajuste regular, sin ser excesivamente amplias ni ajustadas.

Los pantalones coordinan con la camisa, hechos del mismo material con un brillo sutil. Tienen una cintura relajada y caen rectos, permitiendo una sensación de movimiento y comodidad. La longitud de los pantalones es larga, terminando justo por encima del calzado, lo que ayuda a mantener una línea limpia en todo el conjunto.

El modelo calza zapatos con una suela de plataforma gruesa, que continuando con la estética moderna, añade corpulencia y una silueta contundente en contraste con las líneas más limpias de la ropa. El color de los zapatos es negro, coherente con el esquema monocromático del conjunto.

No se observan estampados ni adornos adicionales en la ropa, lo que enfatiza la simplicidad y la textura del material.

En general, la vestimenta podría asociarse con tendencias contemporáneas que valoran la simplicidad y la atemporalidad. Los diseñadores actuales a menudo exploran la relación entre la moda y la funcionalidad, y este conjunto podría ser un ejemplo de esa filosofía. La elección de material, la paleta de colores y la silueta son indicativas de un diseñador o marca que abraza conceptos vanguardistas mientras mantiene una base en estilos clásicos. Este enfoque es frecuente en marcas de alta gama que se especializan en ropa de lujo con un toque moderno.",https://assets.vogue.com/photos/65c0b282f669caad9cb6bf57/master/w_2560%2Cc_limit/00002-soulland-fall-2024-ready-to-wear-copenhagen-credit-brand-sascha-oda.jpg
2024_02_20_19_00,"La imagen muestra una modelo de pie en una pose neutral frente a un fondo gris claro, lo que proporciona un contraste visual que resalta la ropa. La modelo lleva una mezcla interesante de prendas que parecen combinar influencias de la moda contemporánea con toques clásicos.

La prenda destacada es un chaleco tejido de gran tamaño con una textura robusta, presentando lo que podría ser un trabajo de ganchillo o tricotado con hilo grueso. El color del chaleco es un marrón terroso con destellos de otros colores mezclados, lo cual añade profundidad visual al diseño. Este tipo de prenda sugiere una preferencia por la comodidad y la expresión individualista en la moda actual, así como un aprecio por técnicas artesanales.

Debajo del chaleco, la modelo lleva una camisa de botones con cuello de punta. La camisa es de un color azul cielo suave, que crea un contraste relajante con el tono más oscuro del chaleco. Esta pieza aporta una sensación de formalidad al atuendo y refleja una tendencia hacia la superposición de prendas en configuraciones modernas.

Los pantalones son anchos y de talle alto, con una clara influencia de la moda masculina, recordando los estilos populares de los años 70 u 80 pero reinterpretados en un contexto contemporáneo. El tejido oscuro, posiblemente denim, muestra costuras contrastantes que enfatizan la estructura y la forma de la prenda.

En los pies, la modelo porta un par de zapatos de estilo mocasín en blanco y negro, con un diseño que evoca la estética clásica y preppy, pero que también puede interpretarse como un guiño a la moda sin género o unisex.

En términos generales, el look mezcla texturas y siluetas de una manera que es fiel a las tendencias actuales, donde el juego de proporciones y la mezcla de elementos clásicos y artesanales son clave. Aunque la imagen no proporciona información de marca o diseñador específico, podría estar alineada con marcas que valoran la artesanía y las estructuras relajadas pero sofisticadas. No obstante, sin una referencia directa a una etiqueta o colección, es difícil asignar la imagen a un diseñador en particular. La estética minimalista del escenario y la naturalidad en la pose de la modelo se alinean con una presentación contemporánea de la moda que enfatiza la ropa en sí misma y su portabilidad.",https://assets.vogue.com/photos/65c0b2822f2f333ae6c82d7c/master/w_2560%2Cc_limit/00003-soulland-fall-2024-ready-to-wear-copenhagen-credit-brand-sascha-oda.jpg
2024_02_20_19_00,"La imagen presenta a una modelo femenina en una pasarela, posiblemente durante un desfile de moda. Se destaca por su conjunto coordinado que parece evocar un aspecto contemporáneo con influencias quizás de la moda de los años 70 debido a la mezcla de patrones y colores.

La modelo lleva un suéter tejido de manga larga con un patrón de rayas horizontales que varián en grosor. Los colores del suéter son pasteles y suaves, mezclando tonos de melocotón, celeste, amarillo y rosa pálido, lo que le confiere al atuendo una paleta de color cálida y acogedora. El cuello del suéter es redondo y ajustado, lo cual es un clásico en el diseño de suéteres.

En contraste con la parte superior, lleva una falda larga con volantes que parece ser de seda o un tejido similar con un acabado satinado. La falda tiene un fondo de color ocre y está adornada con un patrón floral grande en colores que armonizan con el suéter, con presencia de marrones, naranjas y toques de azul suave. La confección de la falda incluye volantes, añadiendo movimiento y textura al caminar.

La falda termina a la altura de los tobillos, mostrando los zapatos de plataforma color beige que mantiene la estética suave del conjunto. Las plataformas son de un solo tono y parecen estar cubiertas en una tela o material aterciopelado, que complementa la textura rica y táctil del resto del atuendo. 

El conjunto es interesante por su mezcla de texturas y colores que, aunque son distintos, se conjugan armoniosamente. La suavidad del suéter contrasta con el brillo sutil de la falda, un ejemplo de cómo los distintos materiales pueden ser utilizados en conjunto para crear un look multifacético.

La maquillaje de la modelo es mínimo, enfatizando la belleza natural y permitiendo que el enfoque principal recaiga en la ropa. Su cabello está peinado de manera sencilla, alejándolo de su rostro y manteniendo la atención en el conjunto de moda.

No puedo identificar con certeza el diseñador o la marca sin información adicional, pero el estilo y la combinación de elementos denota una clara intención artística y un diseño bien considerado, típicos de las colecciones presentadas en las semanas de la moda por diseñadores de reputación.",https://assets.vogue.com/photos/65bcbc60967ee1177b97ae19/master/w_2560%2Cc_limit/00002-helmstedt-fall-2024-ready-to-wear-copenhagen-credit-gorunway.jpg
2024_02_20_19_01,"La imagen muestra a una modelo vistiendo un conjunto de moda que presenta varios detalles notables. La vestimenta principal es un vestido de dos piezas que parece inspirarse en la silueta y estilo de los años 60 o 70, con algunos toques contemporáneos.

El tejido del vestido es una tela con estampado de cuadros de estilo pata de gallo de tamaño mediano, predominantemente en tonos marrones con pequeños acentos blancos que proporcionan un contraste sutil. La chaqueta y la falda presentan bordes ribeteados con lo que parece ser piel sintética o lana en tono crema, lo que añade textura y un detalle de lujo al conjunto.

La chaqueta parece ser de corte recto y ajustado, con una longitud que alcanza la cadera, y presenta botones grandes de estilo vintage, posiblemente de baquelita o un material similar, en un tono más oscuro que contrasta con el fondo claro del tejido. La chaqueta y la falda están adornadas con lazos de raso azul eléctrico, que proporcionan un acento de color vibrante y contemporáneo. Los lazos están estratégicamente ubicados en el cierre de la chaqueta, en los bolsillos y en la cintura de la falda, lo que aporta una sensación de cohesión al diseño.

La falda es de corte recto, con una longitud que llega ligeramente por encima de la rodilla, lo que se alinea con la estética retro aludida por otros elementos del diseño.

Además, la modelo lleva unos botines de montaña con un diseño robusto, que combinan cuero negro y detalles en tonos de naranja y crema, lo que agrega un elemento de sorpresa al atuendo y contrasta con el estilo más refinado del vestido. Este choque de estilos puede interpretarse como una declaración de moda que juega con las expectativas y combina lo funcional con lo elegante.

El cabello de la modelo tiene una apariencia húmeda y está partido al medio, lo que resalta la naturalidad y contrasta con la composición más enfocada del vestido. Este peinado podría ser un reflejo de las tendencias actuales en el estilismo, que favorecen la apariencia ""effortless"" y menos estructurada.

El maquillaje parece ser mínimo, enfatizando la belleza natural y evitando competir con la audacia visual de la ropa.

En general, el atuendo parece fusionar elementos clásicos con giros contemporáneos y una mezcla inesperada de texturas y colores, posiblemente señalando una tendencia en la moda actual que celebra la reinterpretación de estilos pasados con un toque moderno e inconformista. Es difícil atribuir este diseño a un diseñador específico sin información adicional, pero claramente refleja un enfoque innovador y lúdico a la moda.",https://assets.vogue.com/photos/65bcbc632a8a19ba0a864826/master/w_2560%2Cc_limit/00003-helmstedt-fall-2024-ready-to-wear-copenhagen-credit-gorunway.jpg
2024_02_20_19_01,"La imagen muestra a una mujer de pie frente a una pared blanca al lado de un rincón de la estructura del edificio. La moda presentada en la imagen es muy distintiva y parece evocar un estilo minimalista con influencias del streetwear contemporáneo, posiblemente con una leve referencia al trabajo de diseñadores como Jil Sander o Marques' Almeida, conocidos por su estética refinada y deconstruida.

La mujer lleva un conjunto de dos piezas que consiste en un abrigo y pantalones a juego, que sugiere una estética utilitaria. El abrigo es notablemente más largo de lo común, extendiéndose más allá de la cadera, con solapas grandes y una silueta sobredimensionada. Su textura parece ser de denim o un tejido similar de algodón grueso, lo cual indica una interpretación contemporánea del clásico traje de trabajo de denim. El color es un azul medio, posiblemente índigo, que es típico del denim tradicional. El abrigo está acompañado de un detalle interesante: botones de color rojo brillante en su frente, lo que añade un punto focal visual y rompe la monotonía del azul.

Los pantalones siguen la misma paleta de color y textura que el abrigo, manteniendo una cohesión en el conjunto. Exhiben un corte amplio, acampanado, y aunque son largos, permiten la visibilidad del calzado, lo que sugiere un estilo contemporáneo dentro de la moda urbana. De hecho, la amplitud del pantalón y su corte pueden ser interpretados como un guiño a estilos retro de los años 70, una época en la que los pantalones acampanados estuvieron muy en boga, pero aquí se reinterpretan con un aire moderno.

El calzado de la modelo son zapatos de punta cerrada, negros y con una pequeña correa, que parece ser de charol por su brillo. Este tipo de zapato añade un toque más formal y contrasta sutilmente con la naturaleza casual del conjunto denim.

La modelo tiene la melena larga y del mismo color dorado que la tela, luciendo suelta y recta, lo que añade una sensación de sin esfuerzo al look general, manteniendo la simplicidad y limpieza de líneas en la estética global. La actitud de la modelo es tranquila y contemplativa, añadiendo un aire de confianza sin esfuerzo a la imagen.

En conjunto, la imagen proyecta un sentido de moda contemporánea y sobria con un toque de individualidad, característico de las tendencias minimalistas y de la reinvención del denim como tejido en la alta moda.",https://assets.vogue.com/photos/65bbbb5456497d42e12673fa/master/w_2560%2Cc_limit/00002-caro-editions-fall-2024-ready-to-wear-copenhagen-credit-nikolai-moeller.jpg
2024_02_20_19_02,"La imagen muestra a una mujer posando frente a una pared sencilla en lo que parece ser una indumentaria inspirada en la moda de finales de los años 70 o principios de los 80, destacada por la silueta y la composición de su atuendo. Está vistiendo un mono o jumpsuit de piernas anchas y mangas cortas, lo que sugiere una influencia de la moda utilitaria. La indumentaria parece estar confeccionada en denim de color azul índigo, un material clásico y duradero que nunca pasa de moda.

El jumpsuit posee un cinturón rojo que cincha la prenda en la cintura de la modelo, añadiendo un punto focal en contraste y mejorando la silueta al crear una división visual. Este contraste de color es elevado por la blusa o camisa de cuello alto de un rojo vibrante que lleva debajo del mono, proporcionando una explosión de color que resalta en el conjunto y puede ser vista a través del escote en V del frente del jumpsuit.

La elección del calzado sigue la paleta de colores audaces con zapatos planos de color rojo, probablemente de cuero o un material sintético, que armonizan con el cinturón y la blusa. Dado que los zapatos son planos y de un estilo práctico, complementan la estética funcional del mono.

Los detalles adicionales son mínimos, lo que sugiere una inclinación hacia una estética más minimalista y enfocada en la estructura de las prendas. La combinación de texturas entre el denim, el cinturón (que podría ser de cuero o un material sintético con una hebilla prominente) y la posible franela o algodón de la blusa, añaden profundidad al conjunto sin sobrecargarlo con adornos.

El cabello largo y liso de la modelo, junto con un maquillaje natural o mínimo, continúa la tendencia de mantener las cosas simples y enfocadas en la calidad de la ropa. En conjunto, la imagen proyecta una elegancia casual con toques retro, haciendo énfasis en líneas limpias y la mezcla de texturas y colores en bloques. No hay logos o marcas visibles que indiquen un diseñador específico, dejando el foco de la imagen puramente en la estética del atuendo y su paleta de colores audaces.",https://assets.vogue.com/photos/65bbbb54edac314092f5878a/master/w_2560%2Cc_limit/00003-caro-editions-fall-2024-ready-to-wear-copenhagen-credit-nikolai-moeller.jpg
2024_02_20_19_03,"La imagen muestra a un modelo que viste una prenda que combina elementos clásicos y contemporáneos en un conjunto estructurado y sofisticado. La pieza central es un abrigo largo de lana en tono gris oscuro, decididamente de corte masculino con solapas anchas y una silueta relajada que evoca las tendencias de la moda masculina sobredimensionada. El abrigo posee un tejido texturizado que sugiere calidad y calidez, y se abrocha con botones grandes que están alineados para mantener la simplicidad del diseño.

Bajo el abrigo, el modelo lleva lo que parece ser un pantalón de cintura alta en un tono gris más claro que ofrece un sutil contraste. Este pantalón cae con un efecto drapeado y fluido, añadiendo un toque de suavidad y movimiento al atuendo rígido que proporciona el abrigo. La fluidez del material podría sugerir una mezcla de telas sintéticas con naturales para permitir ese efecto cascada sin perder estructura.

Las piernas están cubiertas por botas altas de cuero negro que llegan hasta el muslo, dando la impresión de ser como una segunda piel. Esto añade otra textura al conjunto y refleja una tendencia hacia las botas statement que se han visto en colecciones recientes de diseñadores como Balenciaga o Saint Laurent. El brillo del cuero contrasta con la opacidad de los otros materiales, creando un juego de texturas visualmente estimulante.

La paleta de colores está estrictamente limitada a tonos de gris y negro, lo que sugiere una elección deliberada para enfocarse en la forma y textura sobre el color. Por la postura y maquillaje del modelo, la imagen evoca un ambiente de alta moda, posiblemente aludiendo al minimalismo elegante en los diseños de casas de moda como The Row o Jil Sander.

La combinación de proporciones amplias, texturas contrastantes y una paleta restringida de colores hacen de este atuendo una declaración de moda equilibrada que juega con las normas de género y forma. La imagen como tal comunica una sensibilidad moderna con respeto a la sastrería de alta calidad y un estilo atemporal que, aunque contemporáneo, no parece anclado a una temporada específica, lo cual es típico de muchas casas de diseño de lujo que buscan trascender las tendencias pasajeras.",https://assets.vogue.com/photos/65bbb2d41ee3ae8488e8b405/master/w_2560%2Cc_limit/00002-mark-kenly-domino-tan-fall-2024-ready-to-wear-copenhagen-credit%2520gorunway.jpg
2024_02_20_19_03,"La imagen muestra una persona posando con un conjunto que emana un enfoque contemporáneo y estructurado hacia la moda de invierno. La prenda central es un abultado abrigo de invierno en un tono gris acero, caracterizado por su gran volumen y su silueta oversized. La prenda presenta una notable textura suave y parece ser de un material de alta calidad, quizás una mezcla de lana o una alternativa sintética diseñada para aislamiento térmico. El cuello prominente de la chaqueta está adornado con lo que parece ser piel o una imitación de piel, añadiendo un toque de lujo y mayor protección contra el frío.

El abrigo se combina con unos pantalones holgados que siguen el mismo esquema de color y textura, sugiriendo un interés en los conjuntos monocromáticos y unificados de la temporada. La elección de tejidos gruesos y la estructura de las prendas parecen favorecer la funcionalidad y la comodidad, sin renunciar a un aspecto refinado.

Completando el atuendo, hay unas botas altas de cuero negro, cuyo brillo contrasta con la textura mate de las prendas de abrigo. Las botas suben hasta la mitad de la pantorrilla y presentan un ajuste ceñido que contrasta con la amplitud de los pantalones.

El conjunto muestra claras influencias de tendencias actuales de la moda, como la preferencia por la comodidad y la silueta amplia, así como la inclusión de pieles (sintéticas o naturales) para destacar y aportar calidez. No se distinguen logotipos o detalles específicos que puedan identificar a un diseñador o casa de moda específica, pero el estilo y la calidad sugieren una marca de gama alta o de diseñador con un enfoque en la confección y el detalle sartorial.

El peinado de la persona es simple y pulido, con el cabello peinado hacia atrás, lo que complementa la estética minimalista y enfatiza la silueta limpia del conjunto. La imagen parece transmitir un enfoque en la comodidad lujosa, privilegiando unas prendas que son tan funcionales como estéticamente impresionantes.",https://assets.vogue.com/photos/65bbb2d438732674bb1e3351/master/w_2560%2Cc_limit/00003-mark-kenly-domino-tan-fall-2024-ready-to-wear-copenhagen-credit%2520gorunway.jpg
2024_02_20_19_04,"La imagen muestra a una modelo desfilando en una pasarela con un conjunto de moda contemporáneo y llamativo, que parece tomar inspiración de varias tendencias y épocas.

La modelo lleva una prenda superior tipo malla ajustada de manga larga con estampados gráficos que se mezclan en tonos grises, blanco y toques de color pastel, sugiriendo una estética moderna con influencias posiblemente de los años 90 por el estilo de la malla y el patrón reminiscente de ciertos estilos de esa década. El diseño de la malla crea una ilusión de capas y profundidad, y aunque es ceñido, evoca un aire de relajada elegancia.

Sobre la malla, la modelo lleva un corsé sin mangas con un entramado de líneas que forma una estructura geométrica, posiblemente hecha de algún tejido con cuerpo que mantiene su forma. El corsé cuenta con una gama de tonos grisáceos que complementan la prenda inferior. Esta pieza agrega una dimensión de estructura y podría sugerir una influencia de moda histórica por la referencia al corsé, pero reinterpretada de una forma muy moderna y desestructurada.

Los pantalones son de corte holgado y colores suaves, con una mezcla de colores agua que podría estar realizada a través de una técnica de teñido como el tie-dye o una impresión digital que emula dicho efecto. Esto les da un aspecto etéreo y suavemente colorido que contrasta con la rigidez del corsé. Su forma amplia y cómoda proporciona un contraste interesante con la prenda ajustada de la parte superior, y podría apuntar a un resurgimiento de los pantalones anchos y cómodos de los primeros años 2000.

La modelo lleva zapatos de tacón bajo y diseño minimalista en color rojo, los cuales aportan un punto focal de color sólido que rompe con la paleta pastel y gris del conjunto. Los zapatos dan la impresión de ser tanto funcionales como estilísticos y mantienen la mezcla de modernidad con elementos retro.

En cuanto a los accesorios, la modelo lleva un collar grueso de color claro con eslabones grandes que se asemeja a estilos populares en la década de los años 90 y principios de los 2000.

El cabello de la modelo está suelto con un estilo natural y lacio, brindando una sensación de facilidad y una estética relajada que contrapesa el dramatismo potencial de la malla y el corsé. Esto podría ser representativo de las tendencias actuales que se inclinan hacia un look más desenfadado y genuino.

Finalmente, el contexto incluye globos metálicos en tonos rosados y celestes que flotan alrededor, agregando un aire festivo y surrealista a la atmósfera del desfile.

El conjunto es un ejemplo distintivo de la moda actual, que a menudo fusiona diferentes periodos y toma riesgos en las mezclas de texturas, siluetas y patrones, para crear algo novedoso y vanguardista. El diseño podría ser el trabajo de una marca contemporánea que valora la innovación y la intertextualidad en la moda.",https://assets.vogue.com/photos/65bb520a7eeccf5cebf0a428/master/w_2560%2Cc_limit/00002-paolina-russo-fall-2024-ready-to-wear-copenhagen-credit-gorunway.jpg
2024_02_20_19_05,"Estamos observando una imagen de un desfile de moda con un modelo masculino que porta un conjunto que evoca un estilo urbano con influencias del grunge o punk-lite, característico de finales de los años 90 e inicios de los 2000.

El modelo lleva una camiseta de manga corta, de color negro sólido, una prenda básica que permite versatilidad y simplicidad. Lo más notable de la camiseta es el estampado en la parte frontal, que parece ser un diseño gráfico en forma de cruz, adornado con elementos que podrían evocar una estética gótica o alternativa. La textura de la camiseta parece suave y cómoda, sugiriendo posiblemente un jersey de algodón o una mezcla similar.

Sobre la camiseta, hay una prenda que se asemeja a un kilt o una falda escocesa, la cual está sobreposicionada de manera asimétrica sobre los pantalones. Este elemento lleva un estampado que imita un deslavado o efecto tie-dye en tonos verdes azulados, lo que añade un carácter casual y relajado al atuendo, integrando a su vez un toque de originalidad.

Los pantalones son de un tejido vaquero con un lavado peculiar que simula manchas o una textura marmolada. Este acabado les da un toque de desgaste intencionado y único. La silueta de estos parece ser relativamente recta, no ajustada, fiel al estilo de jeans más clásicos, y el largo es el adecuado para descansar sobre el calzado sin arrastrarse.

El modelo porta un colgante de metal que cuelga hasta el pecho, complementando la estética alternativa del conjunto. Además, lleva varias pulseras de cuentas en su muñeca derecha, añadiendo un elemento adicional de estilo individual.

En cuanto al peinado, el modelo mantiene el cabello largo y con flequillo, cuyo estilo podría indicar una despreocupación artística o una inclinación hacia lo retro.

Finalmente, el contexto del desfile aporta a la imagen con globos metálicos y de colores brillantes, contrastando y destacando la paleta de colores neutros y deslavados del atuendo.

Este conjunto no evoca una referencia directa a un diseñador específico, pero captura el espíritu de la moda de calle con una mezcla de elementos modernos y clásicos, mostrando una fusión entre comodidad y expresión personal que es muy valorada en las tendencias actuales de moda.",https://assets.vogue.com/photos/65bb52099b38bc8e354976cf/master/w_2560%2Cc_limit/00003-paolina-russo-fall-2024-ready-to-wear-copenhagen-credit-gorunway.jpg
2024_02_20_19_05,Lamento informarte que no puedo proporcionar detalles acerca de imágenes con personas reales.,https://assets.vogue.com/photos/65bb637827ad11ccf6e17c47/master/w_2560%2Cc_limit/00002-baum-und-pferdgarten-fall-2024-ready-to-wear-copenhagen-credit-gorunway.jpg
