timestamp,image_response,url
2024_02_20_19_05,"La imagen muestra a una modelo desfilando en una pasarela, cuyo atuendo es un claro reflejo de una fusión entre estilos clásicos y contemporáneos. Luce un conjunto que parece inspirarse en la sastrería masculina tradicional, pero con ciertos toques que le aportan un aire moderno y unisex.

La pieza central es un blazer negro de corte recto y holgado, que sugiere comodidad y libertad de movimiento, siguiendo posiblemente la tendencia de moda ""oversized"". Es posible que el blazer tenga hombreras, lo que aportaría una cierta rigidez a la estructura de los hombros, un guiño a la moda de los años ochenta. Debajo del blazer, la modelo lleva una camisa blanca clásica, la cual aparece desabotonada en la parte superior, creando un look relajado y un poco más casual.

Un detalle llamativo del atuendo son las múltiples cadenas doradas que cuelgan alrededor del cuello de la modelo. Estas joyas pueden estar evocando la tendencia de la moda ""chunky"" o maximalista en accesorios, que suele ser popular en distintas épocas y en este caso, añade un rico contraste visual al minimalismo del conjunto en blanco y negro.

Los pantalones son igualmente negros, al parecer del mismo tejido que el blazer, y su corte recto los hace parecer fluidos y cómodos, manteniendo la estética holgada que domina en el outfit. Este tipo de silueta es común en estilos orientados hacia la comodidad y la libertad de géneros.

En cuanto al calzado, se percibe un tipo de sneaker o zapato deportivo con detalles que sugieren ser de diseño contemporáneo, aportando una sensación de estilo urbano y práctico a la vestimenta.

En general, el atuendo podría ser un ejemplo de la incorporación de la indumentaria clásica en un contexto moderno, fusionando tendencias actuales con cortes y estilos que han demostrado su atemporalidad. El diseñador ha jugado con la androginia, la comodidad y la versatilidad, respetando la paleta de colores neutros para permitir que la textura y forma de las prendas hablen por sí solas, mientras que los complementos aportan un toque distintivo y contemporáneo.",https://assets.vogue.com/photos/65bb637832461038aa9644a7/master/w_2560%2Cc_limit/00003-baum-und-pferdgarten-fall-2024-ready-to-wear-copenhagen-credit-gorunway.jpg
2024_02_20_19_06,"Estás observando una prenda con una silueta y estructura que parece fusionar elementos clásicos con un giro moderno y vanguardista. El atuendo es un vestido de longitud media con un estampado abstracto en tonos de verde oscuro, negro y toques de amarillo ocre, creando una apariencia que recuerda a la textura de corteza de árbol o musgo. El tejido tiene una apariencia texturizada y parece tener una caída fluida, lo que sugiere que podría ser una seda o un tejido sintético con propiedades similares.

El cuello alto y el ajuste en la cintura con un cinturón del mismo tejido y estampado enfatizan una figura esbelta, mientras que las mangas largas se adhieren a una estética más conservadora y elegante. El vestido parece cerrarse en la parte frontal, lo que puede indicar una influencia de la moda asiática, como el estilo tradicional de un cheongsam o qipao, combinado con un look occidental contemporáneo.

El modelo está usando gafas de sol de montura gruesa y forma rectangular, lo que añade una actitud moderna y una sensibilidad futurista al conjunto. La elección del calzado es intrigante: botas de charol en color burdeos con una puntera marcada y un ligero brillo, que hacen un contraste audaz con el vestido y podrían señalar influencias del punk o la moda gótica.

En general, la paleta de colores y la elección del estampado dan una impresión sofisticada y algo oscura, que bien podría encajar en las colecciones de otoño/invierno de diseñadores que juegan con los contrastes entre la moda de alta costura y las tendencias de la calle. La combinación de texturas (la suavidad del tejido del vestido y el brillo del charol de las botas) muestra un juego deliberado de contrastes que es común en las pasarelas contemporáneas.

Sin elementos adicionales para identificar la marca o el diseñador, es difícil atribuir esta pieza a una casa de moda específica, pero ciertamente demuestra una inclinación por la fusión de tradicionalismo y modernidad, una característica que podrías encontrar en los trabajos de marcas que disfrutan de desdibujar las líneas entre las diferentes influencias y épocas.",https://assets.vogue.com/photos/65ba91c3b82c1d3f0b034459/master/w_2560%2Cc_limit/00002-henrik-vibskov-fall-2024-ready-to-wear-copenhagen-credit-gorunway.jpg
2024_02_20_19_06,"La imagen muestra un modelo en una pasarela, luciendo un conjunto sobresaliente con claras influencias contemporáneas posiblemente de alta moda. El modelo viste un abrigo oversized con mangas largas y caídas que le confieren una silueta relajada y fluida. Este abrigo tiene un estampado abstracto con manchas y líneas que parecen efectos de pintura en tonalidades de verde musgo, amarillo dorado y toques de negro, creando un aspecto texturizado y dinámico.

El diseño del abrigo recuerda a la técnica de la pintura en salpicadura, popularizada por artistas como Jackson Pollock, con un aire contemporáneo que podría indicar la influencia de una casa de moda dispuesta a experimentar con patrones y siluetas. La ausencia de botones y el frente abierto del abrigo refuerzan su carácter desenfadado y moderno.

El modelo complementa su atuendo con botas altas de charol negras que llegan hasta la mitad de la pantorrilla y tienen un acabado brillante. El brillo del charol proporciona un contraste texturizado y visual con la naturaleza mate y terrenal del tejido del abrigo. El calzado tiene tacones angulares y se nota una plataforma muy sutil que aporta una silueta futurista al conjunto.

En cuanto a los accesorios, el modelo lleva gafas de sol de tamaño grande con montura metálica que parecen tener un acabado dorado o bronceado, lo cual evoca una sensación casi industrial. Estas gafas podrían ser un referente a tendencias futuristas o de ciencia ficción, que a menudo incluyen elementos metálicos y lentes tintadas en dorado o amarillo.

El conjunto transmite una mezcla de influencias que van desde el arte abstracto hasta la moda futurista, y se enmarca dentro de una estética vanguardista a la vez que retiene una accesibilidad en su portabilidad. La paleta de colores, aunque basada en tonos tierra, es enérgica y poco convencional, asegurando que la pieza llame la atención en cualquier ambiente. Aunque no se puede atribuir el diseño a un diseñador específico sin más información, podría encajar dentro de las colecciones de diseñadores de moda contemporáneos conocidos por su enfoque artístico y su uso audaz de texturas y formas.",https://assets.vogue.com/photos/65ba91c2fa392b10eb9f1434/master/w_2560%2Cc_limit/00003-henrik-vibskov-fall-2024-ready-to-wear-copenhagen-credit-gorunway.jpg
2024_02_20_19_07,"La imagen que estoy observando muestra una modelo en lo que parece ser una pasarela de un desfile de moda. La modelo lleva un atuendo que mezcla influencias clásicas con toques modernos.

La pieza principal es un traje sastre de corte femenino. La chaqueta es de color negro con solapas anchas y un prominente cuello blanco que da un fuerte contraste. La chaqueta parece entallada y estructurada, destacando la silueta de la modelo. Las mangas terminan justo en las muñecas, lo que permite vislumbrar el blanco de la blusa o camisa debajo, que pudiera ser de seda o algún otro tejido delicado, añadiendo una capa de contraste visual y suavidad a la rigidez del traje.

La parte inferior del atuendo consiste en una falda negra que parece seguir el mismo tejido y color de la chaqueta. La falda es de corte a la rodilla, y su silueta parece ser ligeramente acampanada o con un corte A, lo que proporciona un cierto movimiento y una sutil feminidad al diseño.

El atuendo se completa con un par de zapatos tipo oxford de plataforma con detalles de tachuelas, que le dan un toque de edginess al conjunto. Los zapatos son igualmente de color negro, lo que proporciona continuidad, pero la decoración en tachuelas añade textura y un punto focal interesante a la base del outfit.

El styling es minimalista, con poco o ningún accesorio visible, permitiendo que la ropa hable por sí misma. La modelo lleva el cabello recogido hacia atrás en un estilo sencillo y el maquillaje es natural, respetando la sobriedad general del look para no distraer de la ropa.

En términos de referencias, la combinación de texturas y la estructura del traje podrían ser indicadores de una influencia de la sastrería clásica con una interpretación moderna y posiblemente andrógina. La mezcla del ajuste preciso de la chaqueta con la falda de corte A y los zapatos robustos de plataforma podría sugerir una fusión entre la moda femenina tradicional y elementos de diseño contemporáneo. El uso de solapas de color contrastante y detalles en los zapatos sugiere un juego con la moda de los años 60 y 70, aunque con una actualización para el gusto moderno.

El diseñador detrás de esta pieza podría estar jugando con la deconstrucción de la silueta clásica femenina mediante la incorporación de detalles masculinos, al tiempo que mantiene un aire de elegancia y sofisticación.",https://assets.vogue.com/photos/65ba8c98b82c1d3f0b034447/master/w_2560%2Cc_limit/00002-stine-goya-fall-2024-ready-to-wear-copenhagen-credit-gorunway.jpg
2024_02_20_19_07,"La imagen muestra una modelo caminando por lo que parece ser una pasarela durante una presentación de moda, con espectadores a ambos lados de la pasarela. La modelo viste una prenda con una estética distintiva que puede asociarse con conceptos de moda contemporánea, posiblemente perteneciente a una colección de diseñador de moda de alta gama.

La prenda es un vestido camisero de manga larga que llega hasta el nivel de las rodillas. El diseño del vestido es recto, con una ligera estructura y se percibe un corte limpio y minimalista en su forma. La tela parece ser lisa y probablemente de un material ligero pero con cierta estructura, posiblemente algodón o una mezcla que mantiene la forma del vestido.

El estampado que adorna el vestido es notablemente gráfico, compuesto por un patrón intrincado de líneas y formas que emulan diagramas arquitectónicos, planos o elementos mecánicos dibujados a mano, lo que podría sugerir una referencia conceptual a la arquitectura o ingeniería. El uso exclusivo del blanco y negro en el estampado acentúa la sensación de bocetos y diseños técnicos, y sugiere un enfoque en la forma y estructura más que en el color.

La silueta del vestido es modesta y tiene un aire de elegancia simple, lo que le permite centrarse en el elaborado estampado. El cuello es de estilo sencillo, careciendo de adornos complejos, y sigue la línea de un vestido camisero tradicional. No se ven accesorios o joyería llamativos, salvo unas zapatillas de tacón bajo, suavemente embellecidas, que complementan sin distraer del conjunto del atuendo.

Esta moda no se asocia inmediatamente con una época pasada específica, lo que sugiere que es una interpretación contemporánea o una creación moderna. La elección de un estampado tan gráfico y la sencillez de la forma del vestido indican una tendencia hacia la moda conceptual o artística, donde el diseño puede estar igualmente en casa en un desfile de moda que en una exposición de arte.

En general, la esencia visual del atuendo captura la intersección del diseño gráfico y la moda, en una pieza que hace una declaración atrevida y reflexiva sin recurrir a adornos superfluos. La imagen encapsula una estética moderna, celebrando la geometría, el orden visual y la arquitectura, elementos que a menudo inspiran y se manifiestan en el mundo de la moda de diseñador.",https://assets.vogue.com/photos/65ba8c998295bd985487614a/master/w_2560%2Cc_limit/00003-stine-goya-fall-2024-ready-to-wear-copenhagen-credit-gorunway.jpg
2024_02_20_19_08,"Estás viendo una imagen que captura un atuendo que parece estar inspirado en la moda casual con un toque de estética grunge o alternativa, posiblemente proviniendo de una colección de diseñador contemporáneo que juega con la sobreposición de prendas y texturas.

El sujeto lleva una camiseta de manga larga en capas, con la capa superior siendo un color gris carbón de corte holgado que cae sobre la capa inferior, la cual presenta mangas con detalles fruncidos o ruched de color marfil, añadiendo interés textural y contraste al diseño. Esta técnica de texturización en las mangas tiene una vaga reminiscencia de ciertas tendencias victorianas, aunque interpretadas de manera moderna y desestructurada.

Los pantalones son de corte amplio, reminiscentes del estilo baggy de los 90, con un lavado ácido gris que sugiere una estética vintage. El ajuste es relajado y se ajusta a la cintura con un cinturón blanco con hebilla negra, ofreciendo un contrapunto claro al gris oscuro de los pantalones.

El modelo lleva también un abrigo o chaqueta oscura sobre su brazo izquierdo, sugiriendo capas adicionales que no se aprecian completamente en esta toma. Los zapatos no son completamente visibles, pero parecen ser de punta cuadrada y en tono oscuro, en armonía con la paleta de colores generales.

Como conjunto, la ropa muestra el juego con proporciones y capas que es típico en algunas subculturas urbanas y en la moda contemporánea. No hay estampados visibles ni decoración ostentosa; el enfoque está en el corte, la forma y la textura. No hay señales inequívocas que apunten a un diseñador específico, pero claramente se alinea con el minimalismo y la androginia que han sido populares en las pasarelas recientes. En resumen, es un look que funde influencias retro con una interpretación moderna y deconstructiva de la moda casual.",https://assets.vogue.com/photos/65ba73774f069f7ae575eece/master/w_2560%2Cc_limit/00002-mfpen-fall-2024-ready-to-wear-copenhagen-credit-gorunway.jpg
2024_02_20_19_08,"Observamos a un modelo masculino que desfila en una pasarela con un atuendo que parece sugerir una fusión de elementos clásicos y contemporáneos de moda masculina. La indumentaria consta de varias piezas, con capas que aportan textura y profundidad al conjunto.

La pieza central del atuendo es una camisa de color gris claro, con un corte que aparenta ser tradicional y botones ocultos, lo que le confiere una estética limpia y pulida. Por encima, luce un chaleco ligero sin mangas que parece hecho del mismo material que la camisa, creando un efecto monocromático. Este chaleco posee un cuello en V y parece ligeramente oversize en comparación con la fisionomía del modelo, lo que añade un toque contemporáneo de deconstrucción a la silueta clásica.

El atuendo se completa con unos pantalones de vestir de corte holgado en un tejido de lana con textura tipo espiga en tonos de gris que recuerdan los trajes tradicionales de sastrería. El pantalón se sostiene a la cintura con un cinturón delgado y su caída recta hasta el zapato sugiere una interpretación moderna del clásico pantalón de pinzas.

Para los accesorios, lleva una corbata con patrón de rayas diagonales en tonos de rojo y gris, que añade un toque de color sutil pero definido al conjunto. El patrón de la corbata podría remitir al estilo de los años 80 por su colorido y diseño, aunque reinterpretado en un contexto moderno.

En cuanto al calzado, el modelo viste unos clásicos zapatos de vestir en cuero negro, con acabado brillante y cordones, que aportan un contrapunto formal al aspecto ligeramente relajado del resto de la vestimenta.

La paleta de colores está dominada por los grises, desde el claro hasta el medio, con un contraste proporcionado por la corbata. Las texturas varían desde la lisa de la camisa y el chaleco hasta la texturizada del pantalón de lana.

La influencia estilística parece combinar la formalidad y la sastrería clásica con toques desenfadados y modernos que desdibujan las fronteras entre la moda casual y formal. El conjunto podría estar informado por tendencias de moda contemporánea que valoran la comodidad y la reinvención de los clásicos tailoring.

No se observan logos o distintivos que hagan referencia explícita a una marca o diseñador en particular, pero el look en general destila una sensibilidad de diseño cuidado, con atención al detalle y a la calidad de los materiales, lo cual suele ser característico de marcas de alta gama o diseñadores que se centran en la sastrería moderna para hombre.",https://assets.vogue.com/photos/65ba7378f5c8d6def0b75f1a/master/w_2560%2Cc_limit/00003-mfpen-fall-2024-ready-to-wear-copenhagen-credit-gorunway.jpg
2024_02_20_19_09,"La imagen muestra a una persona modelando una indumentaria que refleja una combinación de elementos clásicos con tendencias contemporáneas. El modelo lleva una chaqueta estilo motociclista, conocida también como biker jacket, confeccionada en piel de color negro con acabado brillante. Esta pieza es emblemática por su asociación con la subcultura del motociclismo y la estética rebelde. Puede observarse que tiene un corte clásico con solapas anchas y detalles de cremalleras plateadas que añaden un toque utilitario y metálico.

Debajo de la chaqueta, hay una prenda de punto ajustada, presumiblemente un suéter, con una textura visible y patrón de punto acanalado en un color marrón oscuro, lo cual proporciona un contraste sutil pero efectivo con el cuero negro de la chaqueta. Esta combinación de texturas y colores aporta una capa de sofisticación y profundidad al atuendo.

El modelo porta unos pantalones de tiro alto con patrón de rayas diplomáticas en color gris oscuro sobre fondo negro. Esta elección de pantalones sugiere una influencia de la sastrería clásica, pero en una silueta más moderna y relajada, con un ajuste que parece ser ligeramente holgado, lo que añade un elemento contemporáneo al conjunto. Las rayas diplomáticas son una referencia directa a la ropa formal y de negocios tradicional, pero al integrarlas en una silueta más desenfadada, se crea un contraste interesante entre lo formal e informal.

El modelo calza zapatos que no están completamente visibles en la imagen, pero parecen complementar el atuendo de manera discreta, sin llamar excesivamente la atención y manteniendo la armonía general del look. La paleta de colores es neutra y restringida, centrada en negros y grises con el acento del marrón del suéter, lo cual es típico en la moda durante los meses más fríos o en colecciones orientadas hacia un estilo atemporal.

No hay elementos superfluos ni accesorios destacados en la imagen, lo que sugiere un enfoque en la simplicidad y la calidad de los materiales y el corte. El estilismo se enfoca en la combinación de texturas y la silueta elegante pero cómoda, reflejando una sensibilidad de moda que valora la sutileza y el detalle sobre la ornamentación excesiva.

Este atuendo podría asociarse a una tendencia de moda minimalista y utilitaria que tiende a resurgir regularmente en la industria de la moda, donde se prioriza la funcionalidad y el confort sin sacrificar el estilo. Aunque no tengo información específica sobre el diseñador o la marca detrás de estas piezas, el conjunto podría estar alineado con el enfoque de diseñadores contemporáneos que buscan reinterpretar la moda clásica con una sensibilidad moderna.",https://assets.vogue.com/photos/65ba4ddb7c58534d6f303878/master/w_2560%2Cc_limit/00002-the-garment-fall-2024-ready-to-wear-copenhagen-credit-gorunway.jpg
2024_02_20_19_09,"Estamos observando una imagen que destaca una prenda de moda única dentro de un entorno de interior elegante que sugiere una pasarela o exhibición de moda. La modelo presenta una postura recta y una expresión seria, típica de un desfile de moda.

La vestimenta se compone de varias piezas clave:

1. **Suéter de gran tamaño:** La modelo lleva un suéter de punto grueso de color gris oscuro o negro, que parece ser de lana o una mezcla similar que imita esa textura. El tejido es amplio con una trama vistosa, lo que podría indicar un método de punto manual o una técnica que busca replicar esa estética. El suéter tiene un corte muy holgado, con mangas que caen más allá de las muñecas de la modelo, lo que sugiere una tendencia oversized moderna.

2. **Cuello en contraste:** Bajo el suéter, la modelo lleva lo que parece ser un top o vestido con un cuello puntiagudo tipo Peter Pan de color blanco, que contrasta notablemente con el tono oscuro del suéter. Esta capa visible añade un elemento preppy o escolar a la combinación, recomendando una mezcla de siluetas contemporáneas con influencias clásicas.

3. **Pantalones de vestir:** Combinando con el suéter, la modelo viste unos pantalones anchos de talle alto, que caen rectos y se extienden para cubrir la mayoría de los zapatos. Este estilo de pantalón remite a una influencia de sastrería clásica o formal, pero la extrema longitud sugiere también un enfoque moderno en la proporción y forma.

4. **Zapatos:** Apenas visibles debajo de los pantalones, se asoman unos zapatos negros que parecen tener un diseño clásico, posiblemente de cuero, asumiendo una forma de oxford o mocasín por lo poco que se puede apreciar.

5. **Accesorios y Maquillaje:** La modelo lleva pendientes que no son inmediatamente visibles debido a la perspectiva de la imagen. El maquillaje es mínimo pero con un detalle distintivo: hay un punto brillante o decorativo debajo de su ojo derecho, que podría ser un pequeño cristal o un adorno reflectante.

En cuanto a la referencia temporal o diseñador específico, la combinación de siluetas sobredimensionadas con cortes pulcros de sastrería y el cuello contrastante puede sugerir una mezcla de elementos de principios del siglo XXI mezclados con detalles de moda de mediados del siglo XX, aunque no se puede identificar un diseñador específico sin información adicional. La moda presentada parece buscar un equilibrio entre lo confortable y lo elegante, lo cual es una tendencia creciente en el diseño contemporáneo.

El estilo general de la imagen se inclina hacia una estética minimalista y sofisticada con un enfoque en la textura y la forma en lugar de los colores vibrantes o los patrones complejos. Esto puede sugerir que estas prendas pertenecen a una colección diseñada para destacar la calidad del material y la artesanía en la construcción de las prendas.",https://assets.vogue.com/photos/65ba4ddd3dedf51a5470a558/master/w_2560%2Cc_limit/00003-the-garment-fall-2024-ready-to-wear-copenhagen-credit-gorunway.jpg
2024_02_20_19_10,"La imagen muestra una modelo en una pasarela presentando un atuendo que tiene un aire masculino y sofisticado con una paleta de colores neutros. La modelo lleva una chaqueta tipo blazer de corte ajustado en un tono gris medio, con solapas pronunciadas y dos bolsillos con solapa en la parte delantera. La chaqueta posee un acabado que sugiere una textura posiblemente de lana o una mezcla de fibras que imitan la apariencia del tweed, pero con menor textura. Notablemente, la chaqueta se cierra con un único botón, lo cual es un detalle clásico y elegante.

Complementando el blazer, la modelo viste unos pantalones rectos de tiro alto en negro que contribuyen a la silueta alargada y pulida del conjunto. La combinación de colores contrastantes entre el blazer gris y los pantalones negros crea una paleta oscura monocromática que tiene siglos siendo sinónimo de profesionalismo y refinamiento. La camiseta o top que lleva bajo el blazer no es completamente visible, pero parece seguir la nota monocromática.

En cuanto a los accesorios, en la solapa de la chaqueta se observa un broche o insignia circular grande, probablemente metálica, que añade un punto focal distintivo al atuendo, aunque no se puede discernir el diseño del broche. La modelo no muestra joyería prominente ni bolsos, lo que mantiene la atención en la ropa. El peinado de la modelo es simple y pulido, complementando la estética minimalista y sofisticada.

El estilo recuerda a la moda de inspiración andrógina y la sastrería clásica que han sido constantes en la moda desde principios del siglo XX, con una actualización moderna en la estructura y ajuste del blazer. Este look podría ser interpretado como un homenaje a la moda de los años 20 y 30, cuando se popularizó por primera vez la ropa inspirada en el vestuario masculino como una opción para las mujeres, pero con una interpretación contemporánea que se enfoca en la silueta limpia y la forma estructurada.

No se puede atribuir el diseño a un diseñador específico sin una indicación clara de marca, etiqueta o detalles característicos de una casa de moda particular, pero definitivamente es una pieza que estaría en casa en las colecciones de diseñadores que valoran la sastrería clásica con un giro moderno.",https://assets.vogue.com/photos/65ba379bb55cb162751feff6/master/w_2560%2Cc_limit/00002-skall-studio-fall-2024-ready-to-wear-copenhagen-credit-gorunway.jpg
