timestamp,image_response,url
2024_02_20_19_15,"La imagen presenta a una persona posando frente a un fondo reflectante con un patrón geométrico que crea una sensación de simetría. La persona luce un atuendo que refleja una influencia del streetwear contemporáneo con toques de moda urbana y lujo casual.

La prenda principal es una chaqueta con capucha de gran tamaño en tonos de gris, caracterizada por una textura robusta que sugiere un tejido grueso y posiblemente aislante, adecuado para climas fríos. La chaqueta tiene detalles distintivos como un logotipo visible en el pecho, que bien podría ser indicativo de una marca de moda conocida por su asociación con la moda urbana de lujo. Los bolsillos de parche grandes en la parte frontal y la capucha revestida de un material que parece ser pelo sintético o una textura similar agregan elementos funcionales y de diseño a la pieza.

Debajo, la persona lleva una camiseta blanca clásica, que actúa como una base neutra y ligera en contraste con la robustez de la chaqueta. Aunque solo parcialmente visible, ofrece un descanso visual y equilibra la pesadez del atuendo superior.

Los pantalones son vaqueros con una silueta que parece ajustarse alrededor de la cadera y los muslos, pero con una ligera relajación hacia el dobladillo. El lavado del denim es oscuro, con un patrón de salpicadura de pintura blanca y lo que podría interpretarse como un efecto de desgaste o decoloración, lo cual añade una textura visual y un aire de informalidad desenfadada.

Finalmente, el calzado seleccionado aparenta ser de alta calidad, con una paleta de colores que complementa la chaqueta y los vaqueros. Los zapatos son zapatillas de deporte con detalles en blanco, negro y lo que parece ser un gris claro, manteniendo el enfoque casual pero estilizado del conjunto completo.

Generalmente, esta imagen podría referirse a la moda streetwear de mediados de la década de los 2020. El ensamble equilibra entre la comodidad casual y la proyección de una marca de lujo, lo que es típico en la moda contemporánea informal pero consciente de la marca. Aunque puede haber influencias de estilos pasados, como los vaqueros desgastados de los años 90, el look en conjunto es muy moderno y al día con las tendencias actuales de moda urbana.",https://assets.vogue.com/photos/65981fd04c8e6611879b7e0a/master/w_2560%2Cc_limit/00002-philipp-plein-prefall-2024-credit-brand.jpg
2024_02_20_19_16,"Estás observando una imagen que captura una estética poderosa y sofisticada, donde predomina el color negro y los tejidos de aspecto lujoso. El modelo central luce un abrigo de cuero negro con acabado brillante, que se suma a la sensación de lujo y estructura. El diseño del abrigo sugiere un corte contemporáneo con el toque clásico de un cinturón a la altura de la cintura, que acentúa la silueta y proporciona una forma cinética. Dicho cinturón parece también de cuero y destaca por su hebilla grande y prominente.

Debajo del abrigo, se entreve una prenda que podría ser un vestido o un conjunto superior e inferior, también en negro, lo que denota un gusto por la monocromía y posiblemente por la simplicidad en términos de paleta de colores. El tejido de la prenda interior parece tener un acabado mate en contraste con el brillo del cuero, lo que añade profundidad al conjunto total.

El modelo lleva un par de botas negras, que parecen estar también fabricadas en cuero o un material similar, aumentando la cohesión del outfit. El tacón es moderado, lo que sugiere una combinación de elegancia y comodidad.

Además, el modelo lleva varios accesorios que complementan su look. Unos lentes de sol de montura grande y de forma cuadrada aportan un aire misterioso y chic. Un collar corto con eslabones grandes parece ser de metal dorado, añadiendo un toque de color y una referencia sutil a las tendencias de joyería de lujo. Los pendientes son discretos pero elegantes, manteniendo la armonía del ensamble.

El modelo sostiene un bolso de mano negro, grande y estructurado, quizás de cuero, con unas letras en relieve que podrían ser la firma de un diseñador específico, aunque sin especificar cuál. El bolso sugiere funcionalidad sin sacrificar la estética, alineándose con el enfoque utilitario pero sofisticado del conjunto.

El fondo de la imagen tiene un patrón geométrico de mármol blanco y gris, que proporciona un contraste arquitectónico con el conjunto predominantemente negro, sin desviar la atención del tema central de la moda. La composición general de la imagen, con el modelo centrado y el patrón de mármol progresivamente convergiendo, refuerza la sensación de fuerza y enfoque.

En resumen, el look presentado se caracteriza por su paleta monocromática, la mezcla de texturas entre mate y brillo, y la proporción y silueta definidas por el abrigo cinturado. Este conjunto podría evocar influencias de modas pasadas, como el minimalismo de los años 90 o el uso de cuero de los años 80, pero con una interpretación muy moderna y urbana. Sin identificar al diseñador, se puede sugerir que esta imagen refleja un enfoque contemporáneo en la moda femenina de lujo, con un énfasis en piezas clave de alta calidad y accesorios definidos.",https://assets.vogue.com/photos/65981fd0455d1efb5e37681c/master/w_2560%2Cc_limit/00003-philipp-plein-prefall-2024-credit-brand.jpg
2024_02_20_19_16,"La imagen muestra una modelo femenina de pie frente a un fondo que representa flores de gran tamaño con tonalidades rosadas y azules difuminadas, lo que le da un aire de ensueño y crea una atmósfera melancólica pero serena.

La modelo luce una prenda de moda que combina estilos clásicos con un toque contemporáneo. El atuendo es un vestido largo de dos capas. La capa superior es un vestido túnica en un color camel o tostado suave. Este vestido tiene un corte sencillo con un cuello redondeado que cae en punta hacia el frente, proporcionando un detalle visual interesante que recuerda a los collares o los plastrones en prendas históricas. Las mangas son largas y rectas, y el vestido llega justo debajo de la rodilla, donde termina con un ribete oscuro que podría ser negro o azul marino, ofreciendo un acento visual que enmarca la capa inferior.

La capa inferior es de un tono coral o naranja rojizo vibrante, y parece ser un poco más corta que la capa superior, permitiendo que se destaque el contraste de colores y creando una sensación de longitud y verticalidad. Este nivel cromático añade un punto focal dinámico al diseño global y proporciona un shock visual de color que rompe con la neutralidad del camel superior.

En cuanto al calzado, la modelo lleva botas negras de estilo militar con suela dentada gruesa, lo que añade una sensación de robustez y toque urbano a la indumentaria. Estas botas son una declaración de moda que se alinea con las tendencias de calzado robusto y utilitario que han sido populares en las temporadas recientes.

La estética general de la imagen y la indumentaria sugiere una influencia de la moda minimalista y posiblemente de la moda escandinava, que se caracteriza por su simplicidad, líneas limpias y paletas de colores neutros con acentos de color inesperados. No se observa joyería o accesorios, lo que mantiene la atención en las siluetas y la combinación de colores.

En su conjunto, esta imagen y su estilismo juegan con la yuxtaposición de formas sueltas y estructuradas, colores neutralizados con toques vibrantes y referencias modernas con un dejo de inspiración retro, resultando en una expresión de moda contemporánea que abraza la comodidad sin sacrificar la sofisticación visual.",https://assets.vogue.com/photos/65abeaba5c503dd82d1ef8fe/master/w_2560%2Cc_limit/00002-undercover-pre-fall-2024-credit-brand.jpg
2024_02_20_19_17,"Estamos observando una serie de imágenes que muestran a una modelo posando con una pieza de vestuario que parece ser una chaqueta anorak de gran tamaño. La chaqueta es de un llamativo color rojo, con detalles azules y blancos en las solapas de los bolsillos. En la parte inferior, predominan unos pantalones amplios de color marrón, que contrastan con la parte superior. Las llantas de los pantalones parecen exhibir un patrón en franjas paralelas de colores azul, blanco y rojo, un detalle que añade un elemento gráfico interesante.

La chaqueta presenta un diseño funcional con bolsillos grandes y cierres evidentes, mostrando una influencia de la moda utilitaria. La capucha de la chaqueta es amplia y ajustable, lo que sugiere una preocupación tanto por el estilo como por la practicidad.

Los zapatos son gruesos y de color negro, con detalles blancos, siguiendo una tendencia de calzado robusto que ha sido popular en las pasarelas recientes. El volumen de los zapatos parece equilibrar visualmente el tamaño amplio de la chaqueta y los pantalones.

El cabello de la modelo está cortado muy corto, lo que añade un toque moderno y minimalista que complementa el look. Por su parte, el maquillaje es sutíl, lo cual es habitual en las presentaciones de moda donde se pretende que la atención se centre en la ropa.

La combinación de colores, formas y texturas sugiere una influencia de la moda deportiva y de la ropa de exteriores funcional, pero interpretada con un enfoque contemporáneo que enfatiza la silueta y los detalles estructurales. El contexto de la imagen, con una pared estampada con motivos florales en el fondo, contrasta con la estética utilitaria de la indumentaria, lo que podría sugerir una intencionalidad de combinar naturaleza y funcionalidad en un ambiente urbano o, alternativamente, resaltar la moda en un marco que simula un escenario al aire libre.

En términos de época o tendencias, el look parece contemporáneo, con referencias al athleisure y a la moda de ropa técnica, posiblemente ajustándose a las tendencias actuales o de una temporada de moda reciente. No se identifica una referencia directa a un diseñador en específico solo por la imagen, pero este estilo es una firma común en marcas que fusionan ropa deportiva y de alto rendimiento con moda de calle.",https://assets.vogue.com/photos/65abeabbd9d5709ef68d1eb4/master/w_2560%2Cc_limit/00003-undercover-pre-fall-2024-credit-brand.jpg
2024_02_20_19_17,"Estoy observando una imagen que presenta a una mujer con una prenda de vestir que resalta por su corte y estilo distintivo. Ella lleva un blazer de gran tamaño en un tono suave de verde, quizás verde salvia o una variante de verde oliva claro, con una textura que parece ser de lana o una mezcla que imita el aspecto de la lana. El blazer tiene un diseño oversize, lo cual es indicativo de una tendencia contemporánea que prefiere la comodidad y la fluidez en la ropa de sastrería.

El blazer no está abotonado, lo que da un aire informal y despreocupado al conjunto. Además, la ausencia de una prenda visible debajo del blazer añade un toque de atrevimiento y enfoque moderno hacia la feminidad y el empoderamiento femenino en la moda. Los hombros del blazer parecen estar estructurados, lo que proporciona una silueta decididamente poderosa.

Además, lleva pendientes largos y vistosos con lo que parece ser perlas o piezas reflectantes que capturan la luz, ofreciendo un contraste dramático con la simplicidad del blazer. Los pendientes podrían insinuar una influencia de la moda barroca por su tamaño y detalle ornamentado, aportando un toque de opulencia al atuendo generalmente minimalista.

Por el estilo del blazer y los accesorios, podría decirse que hay una mezcla de influencias en la moda. El corte y el tamaño del blazer sugieren una influencia de la moda de los años 80, cuando las prendas de sastrería de gran tamaño y con hombros marcados eran populares. Sin embargo, la forma en que se lleva el blazer es muy actual, acorde con las tendencias de moda que favorecen la mezcla de lo formal con lo casual y el juego con las proporciones tradicionales de la ropa.

No hay suficiente contexto en la imagen para atribuir esta prenda a un diseñador específico, pero muchas casas de moda contemporáneas como Balenciaga, Alexander McQueen o incluso marcas de lujo como Gucci y Saint Laurent, han experimentado con siluetas similares y podrían haber ideado un diseño como este.

En resumen, esta imagen muestra un estilo audaz y moderno que juega con las estructuras clásicas de la sastrería, infundiendo elementos de diseño actuales y un enfoque que desafía las normas tradicionales de la moda. Las texturas y los colores sutiles se combinan con accesorios de declaración para crear un aspecto que es tanto contemporáneo como distintivo.",https://assets.vogue.com/photos/65aa4f5b6e3a13fd487f48bb/master/w_2560%2Cc_limit/00002-hm-studio-spring-2024-ready-to-wear-credit-brand.jpg
2024_02_20_19_18,"La imagen muestra una modelo femenina de pie en un paisaje rocoso al aire libre, presumiblemente en una sesión de fotos de moda. La principal prenda de vestir es un mono corto de cuero negro, caracterizado por un diseño utilitario con acentos de moda contemporáneos.

El mono presenta un estilo de chaqueta de campo, con una línea de cintura elástica que crea una silueta ceñida en la cintura, contrastando con la amplitud que se observa sobre y debajo de esta sección. Esta silueta proporciona una forma relajada, pero estructurada. La prenda tiene mangas largas con puños ajustados, y la parte delantera destaca por una fila de botones visibles, y parece tener bolsillos de parche en el pecho que contribuyen a su estética funcional. El cuero tiene un acabado mate, lo que le confiere un aspecto sofisticado y ligeramente informal.

En cuanto a los accesorios, la modelo lleva zapatos de tacón bajo de punta abierta con un diseño de tiras entrelazadas, que parecen tener una textura de reptil o un estampado estilizado que podría imitar las escamas de algún animal, lo que sugiere una posible inspiración en la naturaleza o en estilos exóticos. Los zapatos incorporan un brillo metálico que contrasta con el acabado mate de la ropa de cuero. El patrón y la textura de los zapatos proporcionan un punto focal ornamental y añaden una capa de complejidad visual a la vestimenta en general.

El estilismo de la modelo es simple, con el cabello recogido en un look bajo y una expresión neutra, permitiendo que la atención se centre en la ropa y los accesorios. No se observan joyas prominentes, lo que sugiere un enfoque minimalista y moderno en el estilismo.

La combinación del paisaje árido y natural con el atuendo de cuero negro y los accesorios con textura crea una narrativa visual de contraste entre lo rústico y la moda moderna. No se aprecian referencias directas a épocas o tendencias históricas específicas, lo que indica que el enfoque está en una visión contemporánea y posiblemente atemporal del estilo.

La ausencia de logos visibles o distintivos hace difícil atribuir la ropa a un diseñador específico sin conocimiento previo, pero la calidad y el estilo de las prendas sugieren una marca con inclinación hacia lo lujoso y lo vanguardista.",https://assets.vogue.com/photos/65aa4f5c911d8a89d2395fdb/master/w_2560%2Cc_limit/00003-hm-studio-spring-2024-ready-to-wear-credit-brand.jpg
2024_02_20_19_18,"En la imagen, vemos una modelo desfilando por lo que parece ser la pasarela de un show de moda, posiblemente durante una semana de la moda en una de las capitales de estilo. La modelo lleva un conjunto monocromático en tonos de marrón, los cuales dan una sensación de sofisticación y seriedad, al mismo tiempo que evoca una estética minimalista.

Ella lleva un abrigo largo de gran tamaño (oversized) que parece estar confeccionado en una lana pesada o una mezcla similar que proporciona textura y estructura. La solapa notablemente grande y las hombreras aportan un toque de influencia de moda de la década de los 80, y la longitud del abrigo cae elegantemente hasta casi alcanzar los tobillos. Esta pieza sugiere un diseño que juega con las proporciones y la silueta masculina, lo cual es una tendencia contemporánea en el mundo de la moda femenina.

Debajo del abrigo, podemos observar una prenda superior que se insinúa sutilmente, sugiriendo un enfoque de moda que juega con la sensualidad a través de la sugerencia en lugar de la exposición directa. Por otro lado, el pantalón a juego, también de corte sobredimensionado, presenta un pliegue profundo y liso que da idea de una tela con caída y peso propio. El pantalón es holgado y proporciona un contraste con la parte más ajustada en los tobillos, donde termina ligeramente por encima del zapato, mostrando un estilo contemporáneo.

Los zapatos son clásicos y elegantes, en un color negro que proporciona el único contraste de color en el atuendo. El estilo de zapatos de punta redonda y tacón bajo da indicios de que el confort no se ha sacrificado por la estética, lo cual es otra tendencia moderna en el diseño de calzado para desfiles.

Aunque no puedo identificar al diseñador o la casa de moda específica sin la obligación de no nombrar personas reales, el estilo de la ropa sugiere una marca que valora el minimalismo con toques de experimentación en la silueta y proporciones, lo cual es típico de diseñadores vanguardistas que buscan reinterpretar los clásicos con un giro moderno.

En general, el atuendo nos habla de una tendencia que favorece cortes limpios, el juego con la estructura de géneros tradicionalmente masculinos en la moda femenina y una paleta de colores neutros que siempre es relevante en el mundo de la moda. Es una representación elegante y sobria, con influencias de décadas pasadas reinterpretadas de una manera fresca y contemporánea.",https://assets.vogue.com/photos/65bcc325942221448ef58fb2/master/w_2560%2Cc_limit/00002-stein-fall-2024-ready-to-wear-tokyo-credit-brand.jpg
2024_02_20_19_18,"Esta imagen muestra a una modelo desfilando con un conjunto que parece inspirado en el estilo sartorial y la moda contemporánea. El atuendo se compone de un abrigo largo y pantalones a juego, ambos confeccionados en una tela que parece ser una mezcla de lana o gabardina, lo cual es apropiado para una vestimenta de temporada otoño/invierno dada su aparente grosor y textura.

El abrigo destaca por su diseño deconstruido o quizás asimétrico; presenta una solapa ancha similar a la de una gabardina clásica y un cierre de doble botonadura que está desplazado, dando una sensación de equilibrio inusual y fresco. Los botones son grandes y contrastantes en color, posiblemente negro, lo que aporta un detalle visual interesante. Además, cuenta con una cinta que podría funcionar como un elemento de ajuste, añadiendo funcionalidad y un detalle adicional al diseño.

Los pantalones parecen ser de corte recto y ajuste relajado, lo que proporciona una silueta fluida y cómoda. La longitud del pantalón llega justo al zapato, lo que sugiere una atención meticulosa al detalle en cuanto a la sastrería.

El color general del conjunto es un gris neutro, versátil y elegante, lo que facilita la incorporación de este atuendo en un armario contemporáneo. La elección de zapatos negros y brillantes complementa el estilo minimalista y refinado del conjunto.

La modelo lleva el pelo recogido hacia atrás en un estilo pulido, y el maquillaje parece natural, lo que sugiere una tendencia hacia la belleza natural y sin esfuerzo, permitiendo que la ropa hable por sí sola.

No se identifican logos o etiquetas visibles en la imagen que señalen a un diseñador o marca específica, pero el estilo y la calidad de la confección sugieren que puede tratarse de una prenda de lujo o de diseño de alta gama. La estética general es moderna con un toque de innovación en la sastrería clásica, posiblemente apuntando a una colección diseñada para un público contemporáneo que aprecia la moda sofisticada y las prendas estructuradas.",https://assets.vogue.com/photos/65bcc32584c4558af0d19175/master/w_2560%2Cc_limit/00003-stein-fall-2024-ready-to-wear-tokyo-credit-brand.jpg
2024_02_20_19_19,"Estoy observando una imagen de moda que destaca por su enfoque en la silueta fluida y la paleta de colores sobria y terrosa. El atuendo consiste en varias piezas que juegan con la estructura y el drapeado. La modelo lleva una amplia capa marrón oscuro que fluye con libertad desde sus hombros hasta más abajo de la cintura, con un corte que se asemeja a los diseños de moda de alta costura, dada su confección que sugiere un enfoque en la forma y el volumen. La capa parece estar hecha de una lana gruesa o un material similar que proporciona textura y un aspecto de calidad.

Debajo de la capa, la modelo lleva lo que parece ser un conjunto monocromático que consiste en un top y pantalones. El top sobresale ligeramente por debajo de la capa y presenta un cuello alto que sugiere una naturaleza funcional y elegante. Los pantalones a juego son de tiro alto y tienen un corte holgado, lo que contribuye a la estética contemporánea y minimalista del conjunto. La elección de colores coordinados entre la capa y el conjunto subyacente habla de un enfoque en la cohesión y la simplicidad de diseño.

En los pies, la modelo usa unas sandalias planas de cuero negro, con un diseño de tiras gruesas que aportan un contraste tanto en textura como en color con respecto al resto del atuendo. Las sandalias son simplistas y parecen enfatizar la comodidad sin renunciar al estilo.

No hay presencia de estampados o patrones en el atuendo; la moda aquí se centra en la forma, la estructura y el juego de proporciones. La ausencia de adornos innecesarios y la elección de una paleta de colores tan restringida sugieren una tendencia hacia la moda de lujo discreta. Este estilo podría ser indicativo de diseñadores contemporáneos que valoran la atemporalidad y la sofisticación en sus piezas, posiblemente inspirándose en tendencias minimalistas y en la moda de principios del siglo XXI que favorece las líneas limpias y las siluetas estructuradas.

En conjunto, la moda presentada en esta imagen parece enfocarse en la calidad de los materiales, la pureza del diseño y la versatilidad de las prendas, cualidades que son apreciadas en el mundo del diseño de moda actual.",https://assets.vogue.com/photos/65b774afee61ed27e5ead5e2/master/w_2560%2Cc_limit/00002-rainmaker-fall-2024-ready-to-wear-tokyo-credit-brand.jpg
2024_02_20_19_19,"La imagen muestra una figura masculina caminando con un semblante sereno y una postura erguida, exudando confianza. Él porta un conjunto que parece encontrar inspiración en la indumentaria tradicional japonesa, posiblemente reinterpretando el clásico kimono o haori. El atuendo consiste en una túnica larga de mangas anchas y de corte sobrio que llega hasta las pantorrillas. Este elemento superior está teñido en un tono azul profundo, casi negro, que denota elegancia y sobriedad.

La túnica superior está hábilmente combinada con una pieza inferior que parece ser una suerte de pantalón amplio o hakama, característico de la indumentaria tradicional japonesa, aunque exhibe un corte más moderno y ajustado al cuerpo. Esta prenda inferior es de un color marrón chocolate, lo cual crea un contraste armónico con la parte superior oscura. La textura general de las telas parece fluida y pesada, sugiriendo alta calidad, como la seda o una mezcla de cashmere.

El modelo está usando un cinturón ancho que parece ser del mismo tejido y color que la prenda inferior, abrazando su cintura de manera que estructura el conjunto y le da forma. Además, lleva calzado que parece ser elegantes slippers o mocasines de cuero negro sin decoración, lo que complementa el look refinado y minimalista.

El atuendo, en su totalidad, es un fino ejemplo de la fusión entre tradición y modernidad, con claras referencias a la vestimenta tradicional asiática adaptadas a un contexto de moda contemporánea. No hay elementos superfluos ni decoraciones excesivas, lo cual encaja perfectamente en la tendencia minimalista vanguardista que aboga por la pureza de las líneas y la calidad de los materiales por encima de ornamentos complicados.

El corte limpio, las proporciones cuidadosamente balanceadas y la paleta de colores atemporal podría sugerir la influencia de diseñadores contemporáneos conocidos por su estética minimalista. Aunque no se pueden identificar etiquetas o logotipos distintivos que hagan referencia directa a una casa de moda específica, el diseño podría estar alineado con las propuestas de marcas que valoran la simplicidad estructurada y la calidad excepcional de los materiales.",https://assets.vogue.com/photos/65b774af122457c7cd65af99/master/w_2560%2Cc_limit/00003-rainmaker-fall-2024-ready-to-wear-tokyo-credit-brand.jpg
